{
  "$schema": "https://json-schema.org/draft/2020-12/schema",
  "$id": "urn:luuna:check-result:0.1",
  "type": "object",
  "additionalProperties": false,
  "required": [
    "schema_version",
    "id",
    "run_id",
    "repository_id",
    "recipe_id",
    "candidate_hash",
    "commit",
    "environment_fingerprint",
    "command",
    "status",
    "exit_code",
    "artifact_refs"
  ],
  "properties": {
    "schema_version": {
      "const": "0.1"
    },
    "id": {
      "type": "string",
      "minLength": 1
    },
    "run_id": {
      "type": "string",
      "minLength": 1
    },
    "repository_id": {
      "type": "string",
      "minLength": 1
    },
    "recipe_id": {
      "type": "string",
      "minLength": 1
    },
    "environment_fingerprint": {
      "type": "string",
      "minLength": 1
    },
    "candidate_hash": {
      "type": "string",
      "pattern": "^sha256:[a-f0-9]{64}$"
    },
    "commit": {
      "type": "string",
      "pattern": "^[a-f0-9]{40,64}$"
    },
    "command": {
      "type": "array",
      "minItems": 1,
      "items": {
        "type": "string"
      }
    },
    "status": {
      "enum": [
        "passed",
        "failed",
        "blocked",
        "cancelled",
        "interrupted"
      ]
    },
    "exit_code": {
      "type": [
        "integer",
        "null"
      ]
    },
    "artifact_refs": {
      "type": "array",
      "items": {
        "type": "string"
      }
    },
    "cwd": {
      "type": "string"
    },
    "started_at": {
      "type": "string",
      "format": "date-time"
    },
    "finished_at": {
      "type": "string",
      "format": "date-time"
    },
    "reason": {
      "type": "string"
    },
    "artifact_hashes": {
      "type": "object",
      "additionalProperties": {
        "type": "string",
        "pattern": "^sha256:[a-f0-9]{64}$"
      }
    },
    "tests_detected": {
      "type": [
        "integer",
        "null"
      ],
      "minimum": 0
    },
    "truncated_artifacts": {
      "type": "array",
      "items": {
        "type": "string"
      }
    }
  },
  "allOf": [
    {
      "if": {
        "properties": {
          "status": {
            "const": "passed"
          }
        }
      },
      "then": {
        "properties": {
          "exit_code": {
            "const": 0
          }
        }
      }
    }
  ]
}
